{
  "author": "AutoEQ",
  "details": "Measured by Filk (passive)",
  "type": "parametric_eq",
  "parameters": {
    "gain_db": -6.8,
    "bands": [
      {
        "type": "low_shelf",
        "frequency": 105,
        "gain_db": -0.3,
        "q": 0.7
      },
      {
        "type": "peak_dip",
        "frequency": 170,
        "gain_db": -14.9,
        "q": 0.58
      },
      {
        "type": "peak_dip",
        "frequency": 365,
        "gain_db": 9.7,
        "q": 0.7
      },
      {
        "type": "peak_dip",
        "frequency": 4186,
        "gain_db": 6.5,
        "q": 2.22
      },
      {
        "type": "peak_dip",
        "frequency": 1569,
        "gain_db": 3.2,
        "q": 1.63
      },
      {
        "type": "high_shelf",
        "frequency": 10000,
        "gain_db": 0.1,
        "q": 0.7
      },
      {
        "type": "peak_dip",
        "frequency": 36,
        "gain_db": -0.5,
        "q": 2.43
      },
      {
        "type": "peak_dip",
        "frequency": 55,
        "gain_db": 0.7,
        "q": 2.85
      },
      {
        "type": "peak_dip",
        "frequency": 7418,
        "gain_db": -1.1,
        "q": 5.47
      },
      {
        "type": "peak_dip",
        "frequency": 69,
        "gain_db": -0.7,
        "q": 5.05
      }
    ]
  }
}
