{
  "author": "AutoEQ",
  "details": "Measured by oratory1990",
  "type": "parametric_eq",
  "parameters": {
    "gain_db": -3.9,
    "bands": [
      {
        "type": "low_shelf",
        "frequency": 105,
        "gain_db": -3.1,
        "q": 0.7
      },
      {
        "type": "peak_dip",
        "frequency": 185,
        "gain_db": -1.3,
        "q": 0.78
      },
      {
        "type": "peak_dip",
        "frequency": 9293,
        "gain_db": 2.5,
        "q": 1.66
      },
      {
        "type": "peak_dip",
        "frequency": 4836,
        "gain_db": 3.9,
        "q": 2.99
      },
      {
        "type": "peak_dip",
        "frequency": 3460,
        "gain_db": -2.8,
        "q": 3.99
      },
      {
        "type": "high_shelf",
        "frequency": 10000,
        "gain_db": -0.7,
        "q": 0.7
      },
      {
        "type": "peak_dip",
        "frequency": 1331,
        "gain_db": 1.5,
        "q": 1.61
      },
      {
        "type": "peak_dip",
        "frequency": 519,
        "gain_db": -0.6,
        "q": 2
      },
      {
        "type": "peak_dip",
        "frequency": 74,
        "gain_db": 0.7,
        "q": 2.61
      },
      {
        "type": "peak_dip",
        "frequency": 39,
        "gain_db": -0.4,
        "q": 1.54
      }
    ]
  }
}