{
  "author": "AutoEQ",
  "details": "Measured by ToneDeafMonk",
  "type": "parametric_eq",
  "parameters": {
    "gain_db": -3.7,
    "bands": [
      {
        "type": "low_shelf",
        "frequency": 105,
        "gain_db": -1.1,
        "q": 0.7
      },
      {
        "type": "peak_dip",
        "frequency": 803,
        "gain_db": 3.5,
        "q": 0.78
      },
      {
        "type": "peak_dip",
        "frequency": 170,
        "gain_db": -3.1,
        "q": 0.89
      },
      {
        "type": "peak_dip",
        "frequency": 4576,
        "gain_db": -5.8,
        "q": 2.33
      },
      {
        "type": "peak_dip",
        "frequency": 6076,
        "gain_db": 5.4,
        "q": 3.47
      },
      {
        "type": "high_shelf",
        "frequency": 10000,
        "gain_db": -0.2,
        "q": 0.7
      },
      {
        "type": "peak_dip",
        "frequency": 2624,
        "gain_db": -1.4,
        "q": 3.59
      },
      {
        "type": "peak_dip",
        "frequency": 1614,
        "gain_db": 0.5,
        "q": 2.66
      },
      {
        "type": "peak_dip",
        "frequency": 3570,
        "gain_db": 0.8,
        "q": 4.28
      },
      {
        "type": "peak_dip",
        "frequency": 64,
        "gain_db": 0.2,
        "q": 1.9
      }
    ]
  }
}