{
  "author": "oratory1990",
  "details": "Harman Target",
  "type": "parametric_eq",
  "parameters": {
    "gain_db": -8.8,
    "bands": [
      {
        "type": "low_shelf",
        "frequency": 100,
        "gain_db": 6,
        "q": 0.6
      },
      {
        "type": "peak_dip",
        "frequency": 200,
        "gain_db": -3.2,
        "q": 0.4
      },
      {
        "type": "peak_dip",
        "frequency": 1050,
        "gain_db": 3.6,
        "q": 0.9
      },
      {
        "type": "peak_dip",
        "frequency": 1350,
        "gain_db": -4.2,
        "q": 1.3
      },
      {
        "type": "peak_dip",
        "frequency": 2600,
        "gain_db": -0.6,
        "q": 1.7
      },
      {
        "type": "high_shelf",
        "frequency": 3200,
        "gain_db": 6,
        "q": 0.71
      },
      {
        "type": "high_shelf",
        "frequency": 10000,
        "gain_db": -2,
        "q": 0.71
      },
      {
        "type": "peak_dip",
        "frequency": 7000,
        "gain_db": 3.5,
        "q": 1.4
      },
      {
        "type": "peak_dip",
        "frequency": 4700,
        "gain_db": -1,
        "q": 2
      }
    ]
  }
}