{
  "author": "AutoEQ",
  "details": "Measured by Super Review (bass plug)",
  "type": "parametric_eq",
  "parameters": {
    "gain_db": -2.8,
    "bands": [
      {
        "type": "low_shelf",
        "frequency": 105,
        "gain_db": 0.3,
        "q": 0.7
      },
      {
        "type": "peak_dip",
        "frequency": 792,
        "gain_db": 3,
        "q": 0.8
      },
      {
        "type": "peak_dip",
        "frequency": 172,
        "gain_db": -2.8,
        "q": 0.84
      },
      {
        "type": "peak_dip",
        "frequency": 4597,
        "gain_db": -3.1,
        "q": 2.59
      },
      {
        "type": "peak_dip",
        "frequency": 6209,
        "gain_db": 3.1,
        "q": 5.1
      },
      {
        "type": "high_shelf",
        "frequency": 10000,
        "gain_db": -1.1,
        "q": 0.7
      },
      {
        "type": "peak_dip",
        "frequency": 1968,
        "gain_db": 0.5,
        "q": 3.88
      },
      {
        "type": "peak_dip",
        "frequency": 62,
        "gain_db": 0.2,
        "q": 1.9
      },
      {
        "type": "peak_dip",
        "frequency": 1298,
        "gain_db": -0.3,
        "q": 3.62
      },
      {
        "type": "peak_dip",
        "frequency": 2718,
        "gain_db": -0.3,
        "q": 4.31
      }
    ]
  }
}