{
  "author": "oratory1990",
  "details": "Harman Target",
  "link": "https://www.dropbox.com/s/3mi1qsqopayh5ws/NAD%20Viso%20HP70.pdf?dl=0",
  "type": "parametric_eq",
  "parameters": {
    "gain_db": -4.5,
    "bands": [
      {
        "type": "peak_dip",
        "frequency": 28,
        "gain_db": 4.5,
        "q": 1
      },
      {
        "type": "peak_dip",
        "frequency": 70,
        "gain_db": -0.7,
        "q": 2
      },
      {
        "type": "peak_dip",
        "frequency": 100,
        "gain_db": -1.8,
        "q": 2.5
      },
      {
        "type": "peak_dip",
        "frequency": 200,
        "gain_db": -1.3,
        "q": 2.5
      },
      {
        "type": "peak_dip",
        "frequency": 310,
        "gain_db": 2.2,
        "q": 1.5
      },
      {
        "type": "peak_dip",
        "frequency": 1250,
        "gain_db": -2.2,
        "q": 2.5
      },
      {
        "type": "peak_dip",
        "frequency": 2200,
        "gain_db": 3.6,
        "q": 1
      },
      {
        "type": "peak_dip",
        "frequency": 4300,
        "gain_db": -3.5,
        "q": 2
      },
      {
        "type": "peak_dip",
        "frequency": 6920,
        "gain_db": -2.3,
        "q": 5
      },
      {
        "type": "peak_dip",
        "frequency": 7250,
        "gain_db": -2,
        "q": 9
      }
    ]
  }
}