{
  "author": "AutoEQ",
  "details": "Measured by crinacle (off-off-off-off)",
  "type": "parametric_eq",
  "parameters": {
    "gain_db": -4.5,
    "bands": [
      {
        "type": "low_shelf",
        "frequency": 105,
        "gain_db": -1.2,
        "q": 0.7
      },
      {
        "type": "peak_dip",
        "frequency": 167,
        "gain_db": -2.9,
        "q": 0.89
      },
      {
        "type": "peak_dip",
        "frequency": 2706,
        "gain_db": 4.8,
        "q": 0.65
      },
      {
        "type": "peak_dip",
        "frequency": 1634,
        "gain_db": -4.9,
        "q": 1.09
      },
      {
        "type": "peak_dip",
        "frequency": 681,
        "gain_db": 1.1,
        "q": 0.8
      },
      {
        "type": "high_shelf",
        "frequency": 10000,
        "gain_db": -0.9,
        "q": 0.7
      },
      {
        "type": "peak_dip",
        "frequency": 9731,
        "gain_db": -0.9,
        "q": 2.31
      },
      {
        "type": "peak_dip",
        "frequency": 5235,
        "gain_db": 2.9,
        "q": 6
      },
      {
        "type": "peak_dip",
        "frequency": 4385,
        "gain_db": -1.9,
        "q": 5.5
      },
      {
        "type": "peak_dip",
        "frequency": 2847,
        "gain_db": 0.9,
        "q": 6
      }
    ]
  }
}
