{
  "author": "oratory1990",
  "details": "Harman Target",
  "type": "parametric_eq",
  "parameters": {
    "gain_db": -10.9,
    "bands": [
      {
        "type": "peak_dip",
        "frequency": 190,
        "gain_db": -3.7,
        "q": 0.5
      },
      {
        "type": "peak_dip",
        "frequency": 700,
        "gain_db": 1.1,
        "q": 0.6
      },
      {
        "type": "peak_dip",
        "frequency": 1650,
        "gain_db": -5,
        "q": 1.2
      },
      {
        "type": "peak_dip",
        "frequency": 3900,
        "gain_db": 12,
        "q": 0.6
      },
      {
        "type": "peak_dip",
        "frequency": 7200,
        "gain_db": -5,
        "q": 3
      },
      {
        "type": "peak_dip",
        "frequency": 10200,
        "gain_db": -5.7,
        "q": 2.5
      },
      {
        "type": "peak_dip",
        "frequency": 14300,
        "gain_db": -3.7,
        "q": 2
      }
    ]
  }
}