{
  "author": "oratory1990",
  "details": "oratory1990 Target",
  "link": "https://www.dropbox.com/s/nvd0u03f8ixke4l/Noble%20K10%20CIEM%20%28oratory1990%20target%29.pdf?dl=0",
  "type": "parametric_eq",
  "parameters": {
    "gain_db": -5,
    "bands": [
      {
        "type": "peak_dip",
        "frequency": 250,
        "gain_db": -3.7,
        "q": 0.45
      },
      {
        "type": "peak_dip",
        "frequency": 800,
        "gain_db": 3,
        "q": 1
      },
      {
        "type": "peak_dip",
        "frequency": 1430,
        "gain_db": -5.9,
        "q": 1
      },
      {
        "type": "peak_dip",
        "frequency": 2500,
        "gain_db": -3.2,
        "q": 1.5
      },
      {
        "type": "peak_dip",
        "frequency": 3270,
        "gain_db": -2.2,
        "q": 6
      },
      {
        "type": "peak_dip",
        "frequency": 4000,
        "gain_db": 8,
        "q": 0.8
      },
      {
        "type": "peak_dip",
        "frequency": 5420,
        "gain_db": -13.2,
        "q": 3
      },
      {
        "type": "peak_dip",
        "frequency": 6000,
        "gain_db": 4,
        "q": 1
      },
      {
        "type": "peak_dip",
        "frequency": 9400,
        "gain_db": -4,
        "q": 6
      },
      {
        "type": "peak_dip",
        "frequency": 11350,
        "gain_db": -6.7,
        "q": 4
      }
    ]
  }
}