{
  "author": "AutoEQ",
  "details": "Measured by crinacle (bass, mids)",
  "type": "parametric_eq",
  "parameters": {
    "gain_db": -3.7,
    "bands": [
      {
        "type": "low_shelf",
        "frequency": 105,
        "gain_db": 1.2,
        "q": 0.7
      },
      {
        "type": "peak_dip",
        "frequency": 229,
        "gain_db": -2.6,
        "q": 0.56
      },
      {
        "type": "peak_dip",
        "frequency": 5006,
        "gain_db": 3.5,
        "q": 1.17
      },
      {
        "type": "peak_dip",
        "frequency": 71,
        "gain_db": 1.5,
        "q": 1.07
      },
      {
        "type": "peak_dip",
        "frequency": 948,
        "gain_db": 2.3,
        "q": 2.31
      },
      {
        "type": "high_shelf",
        "frequency": 10000,
        "gain_db": -6,
        "q": 0.7
      },
      {
        "type": "peak_dip",
        "frequency": 10000,
        "gain_db": 5.1,
        "q": 1.6
      },
      {
        "type": "peak_dip",
        "frequency": 6815,
        "gain_db": -2.6,
        "q": 5.98
      },
      {
        "type": "peak_dip",
        "frequency": 3068,
        "gain_db": -1.1,
        "q": 5.03
      },
      {
        "type": "peak_dip",
        "frequency": 3731,
        "gain_db": 0.6,
        "q": 6
      }
    ]
  }
}