{
  "author": "AutoEQ",
  "details": "Measured by crinacle (2020, worn earpads)",
  "type": "parametric_eq",
  "parameters": {
    "gain_db": -6.3,
    "bands": [
      {
        "type": "low_shelf",
        "frequency": 105,
        "gain_db": 6.8,
        "q": 0.7
      },
      {
        "type": "peak_dip",
        "frequency": 9243,
        "gain_db": 5.8,
        "q": 0.21
      },
      {
        "type": "peak_dip",
        "frequency": 122,
        "gain_db": -3.6,
        "q": 0.45
      },
      {
        "type": "peak_dip",
        "frequency": 2969,
        "gain_db": -4.3,
        "q": 2.34
      },
      {
        "type": "peak_dip",
        "frequency": 1321,
        "gain_db": -3.2,
        "q": 0.99
      },
      {
        "type": "high_shelf",
        "frequency": 10000,
        "gain_db": -2.4,
        "q": 0.7
      },
      {
        "type": "peak_dip",
        "frequency": 5093,
        "gain_db": 1.6,
        "q": 6
      },
      {
        "type": "peak_dip",
        "frequency": 6455,
        "gain_db": -1,
        "q": 6
      },
      {
        "type": "peak_dip",
        "frequency": 84,
        "gain_db": -0.4,
        "q": 3.62
      },
      {
        "type": "peak_dip",
        "frequency": 137,
        "gain_db": 0.3,
        "q": 2.52
      }
    ]
  }
}
