{
  "author": "Rtings/AutoEQ",
  "details": "Target_SenseLab_Aizu",
  "type": "parametric_eq",
  "parameters": {
    "gain_db": -5.8,
    "bands": [
      {
        "type": "low_shelf",
        "frequency": 38.0,
        "gain_db": 6.6,
        "q": 0.65
      },
      {
        "type": "peak_dip",
        "frequency": 4223.0,
        "gain_db": -4.8,
        "q": 2.85
      },
      {
        "type": "peak_dip",
        "frequency": 1856.0,
        "gain_db": 2.0,
        "q": 2.77
      },
      {
        "type": "peak_dip",
        "frequency": 847.0,
        "gain_db": 1.4,
        "q": 1.87
      },
      {
        "type": "peak_dip",
        "frequency": 343.0,
        "gain_db": -0.6,
        "q": 1.63
      }
    ]
  }
}
