{
  "author": "oratory1990",
  "details": "USound Target • preliminary",
  "link": "https://www.dropbox.com/s/dvboobclj6emhwy/KZ%20ZS7%20%28USound%20Target%29.pdf?dl=0",
  "type": "parametric_eq",
  "parameters": {
    "gain_db": 0,
    "bands": [
      {
        "type": "low_shelf",
        "frequency": 158,
        "gain_db": 10,
        "q": 0.65
      },
      {
        "type": "peak_dip",
        "frequency": 50,
        "gain_db": -13.4,
        "q": 0.17
      },
      {
        "type": "peak_dip",
        "frequency": 780,
        "gain_db": 1.8,
        "q": 1
      },
      {
        "type": "peak_dip",
        "frequency": 2330,
        "gain_db": -8.3,
        "q": 1.9
      },
      {
        "type": "high_shelf",
        "frequency": 3000,
        "gain_db": 6,
        "q": 0.7
      },
      {
        "type": "peak_dip",
        "frequency": 4050,
        "gain_db": -7.5,
        "q": 3
      },
      {
        "type": "high_shelf",
        "frequency": 7000,
        "gain_db": -8,
        "q": 0.7
      },
      {
        "type": "peak_dip",
        "frequency": 1375,
        "gain_db": -1.3,
        "q": 2.5
      }
    ]
  }
}