{
  "author": "AutoEQ",
  "details": "Measured by Harpo (bronze nozzle)",
  "type": "parametric_eq",
  "parameters": {
    "gain_db": -2.2,
    "bands": [
      {
        "type": "low_shelf",
        "frequency": 105,
        "gain_db": -1.4,
        "q": 0.7
      },
      {
        "type": "peak_dip",
        "frequency": 703,
        "gain_db": 2.4,
        "q": 1
      },
      {
        "type": "peak_dip",
        "frequency": 177,
        "gain_db": -2,
        "q": 1.03
      },
      {
        "type": "peak_dip",
        "frequency": 63,
        "gain_db": 0.9,
        "q": 1.43
      },
      {
        "type": "peak_dip",
        "frequency": 2622,
        "gain_db": -1.2,
        "q": 2.7
      },
      {
        "type": "high_shelf",
        "frequency": 10000,
        "gain_db": -2.1,
        "q": 0.7
      },
      {
        "type": "peak_dip",
        "frequency": 8554,
        "gain_db": 1.9,
        "q": 3.53
      },
      {
        "type": "peak_dip",
        "frequency": 6048,
        "gain_db": 1.4,
        "q": 5.06
      },
      {
        "type": "peak_dip",
        "frequency": 4781,
        "gain_db": -0.8,
        "q": 5.16
      },
      {
        "type": "peak_dip",
        "frequency": 1470,
        "gain_db": -0.1,
        "q": 2.19
      }
    ]
  }
}
