{
  "author": "AutoEQ",
  "details": "Measured by Innerfidelity (2016, wireless)",
  "type": "parametric_eq",
  "parameters": {
    "gain_db": -4.4,
    "bands": [
      {
        "type": "low_shelf",
        "frequency": 105,
        "gain_db": -0.6,
        "q": 0.7
      },
      {
        "type": "peak_dip",
        "frequency": 209,
        "gain_db": -6.9,
        "q": 0.5
      },
      {
        "type": "peak_dip",
        "frequency": 7293,
        "gain_db": 6.9,
        "q": 0.18
      },
      {
        "type": "peak_dip",
        "frequency": 518,
        "gain_db": 3.6,
        "q": 0.7
      },
      {
        "type": "peak_dip",
        "frequency": 3879,
        "gain_db": -7.5,
        "q": 1.03
      },
      {
        "type": "high_shelf",
        "frequency": 10000,
        "gain_db": -3.5,
        "q": 0.7
      },
      {
        "type": "peak_dip",
        "frequency": 2200,
        "gain_db": 2,
        "q": 3.14
      },
      {
        "type": "peak_dip",
        "frequency": 1395,
        "gain_db": -1,
        "q": 2.33
      },
      {
        "type": "peak_dip",
        "frequency": 3421,
        "gain_db": -2.8,
        "q": 4.75
      },
      {
        "type": "peak_dip",
        "frequency": 4088,
        "gain_db": 2.6,
        "q": 6
      }
    ]
  }
}
