{
  "author": "AutoEQ",
  "details": "Measured by Auriculares Argentina (black nozzle)",
  "type": "parametric_eq",
  "parameters": {
    "gain_db": -6.1,
    "bands": [
      {
        "type": "low_shelf",
        "frequency": 105,
        "gain_db": 7.6,
        "q": 0.7
      },
      {
        "type": "peak_dip",
        "frequency": 73,
        "gain_db": -3.1,
        "q": 0.32
      },
      {
        "type": "peak_dip",
        "frequency": 732,
        "gain_db": 2,
        "q": 1.03
      },
      {
        "type": "peak_dip",
        "frequency": 2464,
        "gain_db": -3.3,
        "q": 1.32
      },
      {
        "type": "peak_dip",
        "frequency": 3847,
        "gain_db": 3.2,
        "q": 1.9
      },
      {
        "type": "high_shelf",
        "frequency": 10000,
        "gain_db": -9.3,
        "q": 0.7
      },
      {
        "type": "peak_dip",
        "frequency": 10000,
        "gain_db": 2.3,
        "q": 1.69
      },
      {
        "type": "peak_dip",
        "frequency": 6862,
        "gain_db": 2.6,
        "q": 2.84
      },
      {
        "type": "peak_dip",
        "frequency": 5740,
        "gain_db": -1.6,
        "q": 5.34
      },
      {
        "type": "peak_dip",
        "frequency": 1321,
        "gain_db": -0.2,
        "q": 3.77
      }
    ]
  }
}
