{
  "author": "AutoEQ",
  "details": "Measured by Jaytiss",
  "type": "parametric_eq",
  "parameters": {
    "gain_db": -6,
    "bands": [
      {
        "type": "low_shelf",
        "frequency": 105,
        "gain_db": -1.8,
        "q": 0.7
      },
      {
        "type": "peak_dip",
        "frequency": 5757,
        "gain_db": 6.1,
        "q": 2.2
      },
      {
        "type": "peak_dip",
        "frequency": 304,
        "gain_db": -2,
        "q": 1.02
      },
      {
        "type": "peak_dip",
        "frequency": 1818,
        "gain_db": -1.1,
        "q": 1.84
      },
      {
        "type": "peak_dip",
        "frequency": 803,
        "gain_db": 1.3,
        "q": 2.3
      },
      {
        "type": "high_shelf",
        "frequency": 10000,
        "gain_db": -7.8,
        "q": 0.7
      },
      {
        "type": "peak_dip",
        "frequency": 74,
        "gain_db": 0.9,
        "q": 2.19
      },
      {
        "type": "peak_dip",
        "frequency": 8502,
        "gain_db": 2.4,
        "q": 2.28
      },
      {
        "type": "peak_dip",
        "frequency": 3346,
        "gain_db": 0.9,
        "q": 3.79
      },
      {
        "type": "peak_dip",
        "frequency": 173,
        "gain_db": -0.2,
        "q": 1.53
      }
    ]
  }
}
