{
  "author": "AutoEQ",
  "details": "Measured by Rtings (balanced earpads)",
  "type": "parametric_eq",
  "parameters": {
    "gain_db": -4.1,
    "bands": [
      {
        "type": "low_shelf",
        "frequency": 105,
        "gain_db": 4.2,
        "q": 0.7
      },
      {
        "type": "peak_dip",
        "frequency": 8280,
        "gain_db": -8.7,
        "q": 0.97
      },
      {
        "type": "peak_dip",
        "frequency": 4605,
        "gain_db": 5.3,
        "q": 2.41
      },
      {
        "type": "peak_dip",
        "frequency": 1524,
        "gain_db": 3.4,
        "q": 0.45
      },
      {
        "type": "peak_dip",
        "frequency": 172,
        "gain_db": -2.4,
        "q": 0.59
      },
      {
        "type": "high_shelf",
        "frequency": 10000,
        "gain_db": -4.5,
        "q": 0.7
      },
      {
        "type": "peak_dip",
        "frequency": 9279,
        "gain_db": 2.1,
        "q": 2.61
      },
      {
        "type": "peak_dip",
        "frequency": 2170,
        "gain_db": 1.1,
        "q": 4.69
      },
      {
        "type": "peak_dip",
        "frequency": 3046,
        "gain_db": -0.7,
        "q": 2.46
      },
      {
        "type": "peak_dip",
        "frequency": 4133,
        "gain_db": 0.7,
        "q": 6
      }
    ]
  }
}