{
  "author": "oratory1990",
  "details": "Harman Target",
  "link": "https://www.dropbox.com/s/5dsgvbhai1afvr6/Kingsound%20KS-H04.pdf?dl=0",
  "type": "parametric_eq",
  "parameters": {
    "gain_db": -9.5,
    "bands": [
      {
        "type": "low_shelf",
        "frequency": 38,
        "gain_db": 4,
        "q": 0.71
      },
      {
        "type": "peak_dip",
        "frequency": 65,
        "gain_db": -1.1,
        "q": 1.4
      },
      {
        "type": "low_shelf",
        "frequency": 105,
        "gain_db": 5.5,
        "q": 0.71
      },
      {
        "type": "peak_dip",
        "frequency": 990,
        "gain_db": -5.2,
        "q": 2.5
      },
      {
        "type": "high_shelf",
        "frequency": 1400,
        "gain_db": 6,
        "q": 0.71
      },
      {
        "type": "peak_dip",
        "frequency": 1500,
        "gain_db": -2.7,
        "q": 2.7
      },
      {
        "type": "peak_dip",
        "frequency": 3400,
        "gain_db": -1.3,
        "q": 4
      },
      {
        "type": "peak_dip",
        "frequency": 4700,
        "gain_db": -1.5,
        "q": 4
      },
      {
        "type": "peak_dip",
        "frequency": 8400,
        "gain_db": -4,
        "q": 6
      },
      {
        "type": "high_shelf",
        "frequency": 11000,
        "gain_db": -10,
        "q": 0.71
      }
    ]
  }
}