{
  "author": "oratory1990",
  "details": "Harman Target",
  "link": "https://www.dropbox.com/s/vzfx5kw28r64gac/Stax%20SR-5%20Gold.pdf?dl=0",
  "type": "parametric_eq",
  "parameters": {
    "gain_db": -7.2,
    "bands": [
      {
        "type": "low_shelf",
        "frequency": 85,
        "gain_db": 6,
        "q": 0.71
      },
      {
        "type": "peak_dip",
        "frequency": 210,
        "gain_db": -1.4,
        "q": 1.1
      },
      {
        "type": "high_shelf",
        "frequency": 1000,
        "gain_db": 7,
        "q": 0.71
      },
      {
        "type": "peak_dip",
        "frequency": 1025,
        "gain_db": -4.1,
        "q": 2.5
      },
      {
        "type": "peak_dip",
        "frequency": 1800,
        "gain_db": 0.7,
        "q": 3
      },
      {
        "type": "peak_dip",
        "frequency": 2870,
        "gain_db": -9.1,
        "q": 2
      },
      {
        "type": "peak_dip",
        "frequency": 5480,
        "gain_db": -8.6,
        "q": 6
      },
      {
        "type": "peak_dip",
        "frequency": 6800,
        "gain_db": 2.5,
        "q": 3
      },
      {
        "type": "peak_dip",
        "frequency": 8700,
        "gain_db": -3.5,
        "q": 6
      },
      {
        "type": "high_shelf",
        "frequency": 12000,
        "gain_db": -10,
        "q": 0.71
      }
    ]
  }
}